ФИО,№ стипендии,Тема,Организация
Павлюк Роман Владимирович,СП-1797.2018.1,Повышение надежности уборочной техники модернизацией неподвижных соединений,"Федеральное государственное бюджетное образовательное учреждение высшего образования ""Ставропольский государственный аграрный университет"""
Панченко Владимир Анатольевич,СП-4051.2018.1,Разработка и исследование солнечных теплофотоэлектрических модулей планарной и концентраторной конструкции для стационарной и мобильной энергогенерации,Федеральное государственное автономное образовательное учреждение высшего образования «Российский университет транспорта»
Паршина Александра Валерьевна,СП-439.2018.1,Теоретическое обоснование и создание технологии оперативного контроля параметров жидких неоднородных углеводородных сред,Федеральное государственное автономное образовательное учреждение высшего образования «Самарский национальный исследовательский университет имени академика С.П. Королева»
Пахомова Марина Владимировна,СП-1527.2018.1,Разработка высокоэффективных катализаторов полимеризации фенилацетилена,Федеральное государственное бюджетное образовательное учреждение высшего образования «Иркутский государственный университет»
Петриев Илья Сергеевич,СП-1237.2018.1,Разработка и исследование водородопроницаемых нанокомпозитных мембран из тонких палладийсодержащих пленок,Федеральное государственное бюджетное образовательное учреждение высшего образования «Кубанский государственный университет»
Петров Алексей Вадимович,СП-3611.2018.1,Управление областью множественной филаментации фемтосекундного лазерного излучения с использованием профилированных пучков на воздушной трассе,Федеральное государственное бюджетное учреждение науки Институт оптики атмосферы им. В.Е. Зуева Сибирского отделения Российской академии наук
Петрова Дарья Андреевна,СП-156.2018.1,"Разработка способов получения и исследование гибридных композитных мембранных материалов, функционализированных природными алюмосиликатными трубками.",Федеральное государственное автономное образовательное учреждение высшего образования «Российский государственный университет нефти и газа (национальный исследовательский университет) имени И.М. Губкина»
Подгорбунских Екатерина Михайловна,СП-2848.2018.1,Механохимическое получение новых видов биотоплива из трудноперерабатываемого растительного сырья,Федеральное государственное бюджетное учреждение науки Институт химии твердого тела и механохимии Сибирского отделения Российской академии наук
Подчуфаров Алексей Алексеевич,СП-4183.2018.1,Исследование энергосберегающей гибридной технологии осушения сжатого воздуха для использования в промышленности и на транспорте,"Федеральное государственное бюджетное образовательное учреждение высшего образования ""Московский государственный технический университет имени Н.Э. Баумана (национальный исследовательский университет)"""
Поздняков Андрей Владимирович,СП-224.2018.1,Разработка новых жаропрочных литейных алюминиевых материалов на базе квазибинарных сплавов систем Al-Cu-Y и Al-Cu-Er.,Федеральное государственное автономное образовательное учреждение высшего образования “Национальный исследовательский технологический университет «МИСиС»
Поляков Дмитрий Андреевич,СП-3627.2018.1,Мониторинг остаточного ресурса изоляции кабелей из сшитого полиэтилена.,Федеральное государственное бюджетное образовательное учреждение высшего образования «Омский государственный технический университет»
Попов Анатолий Николаевич,СП-4680.2018.1,Разработка технологий и модернизация устройств получения твердых биотоплив,Федеральное государственное автономное образовательное учреждение высшего образования «Северный (Арктический) федеральный университет имени М.В. Ломоносова»
Попович Сергей Станиславович,СП-631.2018.1,Экспериментальное исследование параметров термогазодинамики в пограничном слое сжимаемого газа,Федеральное государственное бюджетное образовательное учреждение высшего образования «Московский государственный университет имени М.В.Ломоносова»
Поротникова Наталья Михайловна,СП-2316.2018.1,Маршруты диффузии в оксидах со смешанной кислород-ионной и электронно-дырочной проводимостью,Федеральное государственное бюджетное учреждение науки Институт высокотемпературной электрохимии Уральского отделения Российской академии наук
Потылицын Вадим Сергеевич,СП-904.2018.1,Разработка физических принципов и технологии поиска углеводородного сырья на основе извлечения информации из естественного электромагнитного и сейсмического шумов Земли,Федеральное государственное автономное образовательное учреждение высшего образования «Сибирский федеральный университет»
Просвирников Дмитрий Богданович,СП-4422.2018.1,Разработка теоретических основ диспергирования химически активированных капиллярно-пористых материалов в условиях паровзрывного вскипания перегретых метастабильных жидкостей ,Федеральное государственное бюджетное образовательное учреждение высшего образования «Казанский национальный исследовательский технологический университет»
Путилова Евгения Александровна,СП-150.2018.1,"Исследование структуры, физико-механических и эксплуатационных характеристик высокопрочных экономнолегированных сталей для нефтегазопромысловых труб, эксплуатируемых в экстремальных климатических условиях",Федеральное государственное бюджетное учреждение науки Институт машиноведения имени Э.С. Горкунова Уральского отделения Российской академии наук
Разумов Михаил Сергеевич,СП-591.2018.1,Повышение энергоэффективности машин содержащих моментопередающие соединения,Федеральное государственное бюджетное образовательное учреждение высшего образования «Юго-Западный государственный университет»
Рогожин Павел Викторович,СП-174.2018.1,Разработка и внедрение технологии изготовления многослойных облицовок для нефтяного перфоратора с усиленной эффективностью действия,"Федеральное государственное бюджетное образовательное учреждение высшего образования ""Самарский государственный технический университет"""
Роньшин Федор Валерьевич,СП-2907.2018.1,Исследование двухфазного течения в коротких прямоугольных горизонтальных микроканалах,Федеральное государственное бюджетное учреждение науки Институт теплофизики им. С.С. Кутателадзе Сибирского отделения Российской академии наук
Садыков Артур Мунавирович,СП-5431.2018.1,"Разработка метода повышения эффективности работы тепловой сети на базе сбора, анализа и обработки показаний приборов учета",Федеральное государственное бюджетное образовательное учреждение высшего образования «Ивановский государственный энергетический университет имени В.И. Ленина»
Садырин Евгений Валерьевич,СП-3672.2018.1,"Разработка упрощённых аналитических моделей эксперимента по наноиндентированию материалов с однородными, слоистыми или функционально-градиентными покрытиями",Федеральное государственное бюджетное образовательное учреждение высшего образования «Донской государственный технический университет»
Сайфуллин Эмиль Ринатович,СП-647.2018.1,Разработка энергоэффективного способа сжигания углеводородного топлива переменного состава в теплоэнергетических установках,Федеральное государственное автономное образовательное учреждение высшего образования «Казанский (Приволжский) федеральный университет»
Самойленко Владимир Валерьевич,СП-5142.2018.1,Разработка энергосберегающей системы управления микроклиматом теплиц на основе беспроводных биосенсорных сетей,"Федеральное государственное бюджетное образовательное учреждение высшего образования ""Ставропольский государственный аграрный университет"""
Санин Виталий Владимирович,СП-180.2018.1,"Разработка основ энерго- и материалосберегающей технологии получения высоколегированных сплавов на основе Сo, Ni и Fe, включающий синтез сплавов в режиме фронтального горения и стадию рафинирующего вакуумно-индукционного переплава.",Федеральное государственное автономное образовательное учреждение высшего образования “Национальный исследовательский технологический университет «МИСиС»
Саяхов Ильдус Финатович,СП-176.2018.1,Разработка электромеханического привода для стыковочных устройств космических аппаратов,"Федеральное государственное бюджетное образовательное учреждение высшего образования ""Уфимский государственный авиационный технический университет"""
Сергевнин Виктор Сергеевич,СП-5058.2018.1,"Разработка нового класса износостойких наноструктурных покрытий, адаптируемых к меняющимся условиям трения и снижающих энергопотребление пар трения машин и механизмов",Федеральное государственное автономное образовательное учреждение высшего образования “Национальный исследовательский технологический университет «МИСиС»
Середа Владимир Владимирович,СП-3103.2018.1,Исследование химической деформации перспективных протонпроводящих сложнооксидных материалов для устройств преобразования энергии,Федеральное государственное автономное образовательное учреждение высшего образования «Уральский федеральный университет имени первого Президента России Б.Н. Ельцина»
Сивальнева Мариана Николаевна,СП-2116.2018.1,"Разработка принципов управления качественными показателями ячеистых композитов, полученных на основе бесцементных минеральных вяжущих систем",Федеральное государственное бюджетное образовательное учреждение высшего образования «Белгородский государственный технологический университет им. В.Г. Шухова»
Сироткин Евгений Анатольевич,СП-71.2018.1,Разработка дублирующей адаптивной системы управления мощностью ветроэнергетической установки,"Федеральное государственное автономное образовательное учреждение высшего образования ""Южно-Уральский государственный университет (национальный исследовательский университет)"""
Скрипкина Татьяна Сергеевна,СП-128.2018.1,Разработка механохимической технологии глубокой переработки бурого угля для комплексного использования угольных месторождений,Федеральное государственное бюджетное учреждение науки Институт химии твердого тела и механохимии Сибирского отделения Российской академии наук
Сливкин Евгений Владимирович,СП-2865.2018.1,Исследование физико-химических процессов высокоселективного химического травления и электрохимической модификации поверхности металлических структур для создания новых технологий МЭМС-устройств.,"Федеральное государственное бюджетное образовательное учреждение высшего образования ""Рязанский государственный радиотехнический университет имени В.Ф. Уткина"""
Смирнова Мария Николаевна,СП-2838.2018.1, Создание на основе ферритов материалов нового поколения для устройств спинтроники,Федеральное государственное бюджетное учреждение науки Институт общей и неорганической химии им. Н.С. Курнакова Российской академии наук
Смолий Виктория Александровна,СП-1296.2018.1,"""Разработка технологии производства энергосберегающих трехслойных панелей для энергоэффективных жилых и общественных объектов крупнопанельного и каркасно-панельного домостроения""",Федеральное государственное бюджетное образовательное учреждение высшего образования «Южно-Российский государственный политехнический университет (НПИ) имени М.И. Платова»
Солманов Павел Сергеевич,СП-2296.2018.1,Исследование физико-химических свойств NiMo(W)S кластеров  катализаторов гидрогенизационных процессов при различных степенях заполнения поверхности P-модифицированного гамма-оксида алюминия ,"Федеральное государственное бюджетное образовательное учреждение высшего образования ""Самарский государственный технический университет"""
Стремоухов Сергей Юрьевич,СП-4085.2018.1,"Исследование генерации произвольно поляризованного когерентного излучения терагерцового, ультрафиолетового и рентгеновского диапазонов протяженными  газовыми средами, взаимодействующими с полихроматическими лазерными полями","Федеральное государственное бюджетное учреждение ""Национальный исследовательский центр ""Курчатовский институт"""
Сунагатуллина Алиса Шамилевна,СП-2920.2018.1,Разработка эффективных антиагломерантов для предотвращения образования газогидратных пробок при транспортировке и добыче углеводородов,Федеральное государственное бюджетное образовательное учреждение высшего образования «Уфимский государственный нефтяной технический университет»
Сухачев Илья Сергеевич,СП-829.2018.1,Повышение энергоэффективности добычи нефти путем совершенствования защиты погружных электродвигателей от воздействия внутренних и внешних перенапряжений,"Федеральное государственное бюджетное образовательное учреждение высшего образования ""Тюменский индустриальный университет"""
Сысоева Татьяна Игоревна <i>(Зимина)</i>,СП-5298.2018.1,"Разработка энергосберегающей технологии вторичного использования тепловой энергии, высвобождаемой в процессе производства алюминия электролитическим способом","Федеральное государственное бюджетное образовательное учреждение высшего образования ""Иркутский национальный исследовательский технический университет"""
Табакаев Роман Борисович,СП-187.2018.1,Технология получения жидкого биотоплива в процессе низкотемпературной деструкции твердых органических отходов и каталитического риформинга,Федеральное государственное автономное образовательное учреждение высшего образования «Национальный исследовательский Томский политехнический университет»
Тарасов Иван Анатольевич,СП-2796.2018.1,"Гибридные нанокристаллы на основе железа, силицидов железа и благородных металлов: исследование процессов формирования и физических свойств","Федеральное государственное бюджетное научное учреждение ""Федеральный исследовательский центр ""Красноярский научный центр Сибирского отделения Российской академии наук"""
Тараторин Андрей Андреевич,СП-3372.2018.1,Разработка основ энергоэффективных промышленных глушителей шума,"Федеральное государственное бюджетное образовательное учреждение высшего образования ""Национальный исследовательский университет ""МЭИ"""
Тишин Алексей Анатольевич,СП-1447.2018.1,Разработка нового поколения автономных энергоэффективных мембранно-сорбционных генераторов дыхательных смесей для питания аппаратов искусственной вентиляции легких,Федеральное государственное автономное образовательное учреждение высшего образования «Национальный исследовательский ядерный университет «МИФИ»
