ФИО,№ стипендии,Тема,Организация
Денисенко Дарья Юрьевна,СП-1778.2019.3,"Разработка и исследование нового поколения низкочувствительных, универсальных (ФНЧ, ФВЧ, ПФ, РФ) и перестраиваемых активных RC-фильтров на основе радиационно-стойких и низкотемпературных БМК для задач аналого-цифрового преобразования сигналов датчиков",Федеральное государственное бюджетное образовательное учреждение высшего образования «Донской государственный технический университет»
Дикарева Наталья Васильевна,СП-1302.2019.3,Разработка лазерных наногетеросистем для волоконных линий связи и коммуникационных устройств нового поколения,Федеральное государственное автономное образовательное учреждение высшего образования «Национальный исследовательский Нижегородский государственный университет им. Н.И. Лобачевского»
Еремин Никита Викторович,СП-481.2019.3,Расчет и прогнозирование ресурса металлокомпозитных баков высокого давления,"Федеральное государственное бюджетное научное учреждение ""Федеральный исследовательский центр информационных и вычислительных технологий"""
Ефтифеева Анна Сергеевна,СП-1443.2019.3,Исследование циклической стабильности в условиях экстремальных температур монокристаллов сплавов с памятью формы CoNiAl для термомеханических приводов и демпферов,Федеральное государственное автономное образовательное учреждение высшего образования «Национальный исследовательский Томский государственный университет»
Залогина Анастасия Сергеевна,СП-3962.2019.3,Экспериментальное и теоретическое исследование контроля оптических излучателей интегрированных в наноалмаз за счет наноантенн с высоким показателем преломления,Федеральное государственное автономное образовательное учреждение высшего образования «Национальный исследовательский университет ИТМО»
Зарецкая Галина Александровна,СП-3145.2019.3,Исследование оптических интегральных структур для фильтрации СВЧ сигнала,Федеральное государственное автономное образовательное учреждение высшего образования «Санкт-Петербургский государственный электротехнический университет «ЛЭТИ» им. В.И. Ульянова (Ленина)»
Квашенкина Ольга Евгеньевна,СП-2837.2019.3,Разработка технологии создания многослойных металлических наноструктур с прогнозируемыми теплофизическими параметрами самораспространяющегося высокотемпературного синтеза.,Федеральное государственное автономное образовательное учреждение высшего образования «Санкт-Петербургский политехнический университет Петра Великого»
Кислицын Алексей Александрович,СП-2729.2019.3,Развитие методов исследования влияния частотной дисперсии в трансионосферных радиоканалах и адаптивной компенсации потерь помехоустойчивости связи по данным сети ГЛОНАСС,Федеральное государственное бюджетное образовательное учреждение высшего образования «Поволжский государственный технологический университет»
Кузнецова Александра Михайловна,СП-473.2019.3,Применение новых методов спутникового дистанционного зондирования для развития методик мониторинга и прогноза волнения в арктических морях,"Федеральное государственное бюджетное научное учреждение ""Федеральный исследовательский центр Институт прикладной физики Российской академии наук"""
Куркин Евгений Игоревич,СП-3590.2019.3,Разработка методик автоматизации проектирования и производства конструкций аэрокосмического назначения из короткоармированных композиционных материалов,Федеральное государственное автономное образовательное учреждение высшего образования «Самарский национальный исследовательский университет имени академика С.П. Королева»
Лазарева Надежда Николаевна,СП-355.2019.3,Создание полимер-силикатных композитов с улучшенными эксплуатационными характеристиками для космической и наземной техники,"Федеральное государственное автономное образовательное учреждение высшего образования ""Северо-Восточный федеральный университет имени М.К. Аммосова"""
Леонтьев Виктор Сергеевич,СП-467.2019.3,Исследование и разработка физических принципов создания высокочувствительных датчиков тока на основе градиентных магнитоэлектрических композитных структур для применения в космической аппаратуре.,Федеральное государственное бюджетное образовательное учреждение высшего образования «Новгородский государственный университет имени Ярослава Мудрого»
Макаров Александр Андреевич,СП-834.2019.3,"Синтез, анализ и моделирование алгоритмов обработки квазидетерминированных и стохастических сигналов в условиях параметрической и непараметрической априорной неопределенности","Федеральное государственное бюджетное образовательное учреждение высшего образования ""Национальный исследовательский университет ""МЭИ"""
Милахин Денис Сергеевич,СП-136.2019.3,"Разработка in-situ пассивированных AlN/GaN гетероэпитаксиальных структур для КВЧ и силовых транзисторов для радиоастрономических исследований, спутниковой радиосвязи и наземной радиолокации",Федеральное государственное бюджетное учреждение науки Институт физики полупроводников им. А.В. Ржанова Сибирского отделения Российской академии наук
Носов Александр Вячеславович,СП-2042.2019.3,Многокаскадные устройства защиты от сверхкоротких импульсов на основе меандровых линий задержки,"Федеральное государственное бюджетное образовательное учреждение высшего образования ""Томский государственный университет систем управления и радиоэлектроники"""
Одинцова Татьяна Анатольевна,СП-3053.2019.3,Континуальное поглощение ТГц излучения атмосферными газами: природа и моделирование в интересах дистанционного зондирования.,"Федеральное государственное бюджетное научное учреждение ""Федеральный исследовательский центр Институт прикладной физики Российской академии наук"""
Пахомов Илья Викторович,СП-1563.2019.3,Разработка и исследование аналоговых микросхем с малым уровнем шумов на основе CJFet технологического процесса и комплементарных полевых транзисторов с управляющим p-n-переходом для обработки сигналов датчиков в задачах космического приборостроения,Федеральное государственное бюджетное образовательное учреждение высшего образования «Донской государственный технический университет»
Понарина Мария Владимировна,СП-173.2019.3,Волноводные твердотельные лазеры со сверхвысокой частотой повторения импульсов ,Федеральное государственное бюджетное учреждение науки Федеральный исследовательский центр «Институт общей физики им. А.М. Прохорова Российской академии наук»
Рогожников Евгений Васильевич,СП-1321.2019.3,Разработка и исследование технологий повышения спектральной эффективности систем передачи данных по цепям питания,"Федеральное государственное бюджетное образовательное учреждение высшего образования ""Томский государственный университет систем управления и радиоэлектроники"""
Рязанцев Александр Юрьевич,СП-1228.2019.3,Исследование влияния комбинированных методов обработки на термодинамические характеристики ракетных двигателей,Федеральное государственное бюджетное образовательное учреждение высшего образования «Воронежский государственный технический университет»
Садовников Сергей Александрович,СП-879.2019.3,Исследование пространственного распределения и временной динамики концентрации CH4 и N2O в приземном слое атмосферы с использованием лидарных и спутниковых средств измерений,Федеральное государственное бюджетное учреждение науки Институт оптики атмосферы им. В.Е. Зуева Сибирского отделения Российской академии наук
Степанов Константин Викторович,СП-794.2019.3,Создание распределённой волоконно-оптической системы мониторинга состояния железнодорожного транспорта и инфраструктуры с повышенной чувствительностью,"Федеральное государственное бюджетное образовательное учреждение высшего образования ""Московский государственный технический университет имени Н.Э. Баумана (национальный исследовательский университет)"""
Стриженок Алексей Владимирович,СП-3455.2019.3,"Дешифрирование геоэкологических условий и экологическое картографирование территорий, подверженных негативному воздействию хранилищ отходов минерально-сырьевого комплекса, на основании многовременной космосъемки.","Федеральное государственное бюджетное образовательное учреждение высшего образования ""Санкт-Петербургский горный университет"""
Шалымов Егор Вадимович,СП-2660.2019.3,Оптические преобразователи угла  на основе наноструктурированных метаповерхностей ориентированные на применение в космической технике,Федеральное государственное автономное образовательное учреждение высшего образования «Санкт-Петербургский государственный электротехнический университет «ЛЭТИ» им. В.И. Ульянова (Ленина)»
Шаповалов Игорь Олегович,СП-1108.2019.3,Организация и исследование группового взаимодействия систем управления роботов космического базирования при перемещении крупногабаритных объектов,"Автономная некоммерческая организация высшего образования ""Университет Иннополис"""
Шаповалова Оксана Вячеславовна,СП-459.2019.3,Разработка комплекса технологий получения детонационных углеродных наноструктур для совершенствования перспективных композиционных материалов,Федеральное государственное бюджетное учреждение науки Федеральный исследовательский центр химической физики им. Н.Н. Семенова Российской академии наук
Южакова Анастасия Алексеевна <i>(Лашова)</i>,СП-1581.2019.3,"Моделирование свойств и изготовление фотонно-кристаллических световодов для космических исследований в среднем ИК диапазоне от 2,0 до 50,0 мкм",Федеральное государственное автономное образовательное учреждение высшего образования «Уральский федеральный университет имени первого Президента России Б.Н. Ельцина»
Якименко Кирилл Александрович,СП-911.2019.3,Разработка программного обеспечения для структурного проектирования гибридных синтезаторов частот и анализа их шумовых характеристик,Федеральное государственное бюджетное образовательное учреждение высшего образования «Владимирский государственный университет имени Александра Григорьевича и Николая Григорьевича Столетовых»
Яковлев Иван Александрович,СП-375.2019.3,"Синтез ферромагнитных наноструктур на основе Fe-Si в магнитном поле для улучшения характеристик, и исследование их структурных и СВЧ магнитных свойств","Федеральное государственное бюджетное научное учреждение ""Федеральный исследовательский центр ""Красноярский научный центр Сибирского отделения Российской академии наук"""
,,,
Агейкин Алексей Викторович,СП-342.2019.4,Превентивная диагностика пограничных психических расстройств на основе комплексного анализа ЭЭГ- и МРТ-маркеров.,"Федеральное государственное бюджетное образовательное учреждение высшего образования ""Пензенский государственный университет"""
Алексанян Грайр Каренович,СП-21.2019.4,Разработка технологии персонализированного мониторинга и оценки нарушений регионарных вентиляционно-перфузионных отношений легких человека методом трехмерной многочастотной электроимпедансной томографии,Федеральное государственное бюджетное образовательное учреждение высшего образования «Южно-Российский государственный политехнический университет (НПИ) имени М.И. Платова»
Алексеева Яна Валерьевна,СП-3625.2019.4,Влияние феноменов микрососудистого повреждения миокарда на течение воспалительного ответа и агрегационную активность тромбоцитов при инфаркте миокарда.,"Федеральное государственное бюджетное научное учреждение ""Томский национальный исследовательский медицинский центр Российской академии наук"""
Алиева Камилла Натиговна,СП-3310.2019.4,Прогноз «анти-мутантного» эффекта комбинаций антибиотиков при моделировании их фармакокинетики в динамических системах in vitro,"Федеральное государственное бюджетное научное учреждение ""Научно-исследовательский институт по изысканию новых антибиотиков имени Г.Ф. Гаузе"""
Андреенков Вячеслав Сергеевич,СП-2117.2019.4,"Разработка способов диагностики, прогнозирования и лечения острого панкреатита","Федеральное государственное бюджетное научное учреждение ""Федеральный научно-клинический центр реаниматологии и реабилитологии"""
Антифеева Юлия Алексеевна,СП-259.2019.4,"Блокировка формирования комплекса между онкогенным белком протимозином альфа и линкерным гистоном Н1, препятствующим опухолевой трансформации клеток",Федеральное государственное бюджетное учреждение науки Институт цитологии Российской академии наук
Артемьев Дмитрий Николаевич,СП-2902.2019.4,"Разработка оптоволоконного зонда, эффективно регистрирующего сигналы флуоресценции и Рамановского рассеяния, для диагностики онкологических новообразований человека",Федеральное государственное автономное образовательное учреждение высшего образования «Самарский национальный исследовательский университет имени академика С.П. Королева»
Архипова Анастасия Юрьевна,СП-3913.2019.4,Раневые покрытия на основе регенерированного фиброина,Федеральное государственное бюджетное образовательное учреждение высшего образования «Московский государственный университет имени М.В.Ломоносова»
Ахлюстина Екатерина Витальевна,СП-756.2019.4,"Фототераностика с использованием инфракрасных катионных фотосенсибилизаторов локальных очагов инфекционных поражений, вызванных глубокоинвазирующими антибиотикорезистентными возбудителями",Федеральное государственное автономное образовательное учреждение высшего образования «Национальный исследовательский ядерный университет «МИФИ»
Бабенко Лиана Григорьевна,СП-1850.2019.4,Разработка и исследование специального снаряжения с автоматизированным контролем теплового комфорта гиподинамической системы нижних конечностей человек,Федеральное государственное бюджетное образовательное учреждение высшего образования «Донской государственный технический университет»
Бавыкина Ирина Анатольевна,СП-276.2019.4,"Синдром «дырявого» кишечника и стиль питания при аутизме, как факторы нарушения нутритивного и психоневрологического статуса","Федеральное государственное бюджетное образовательное учреждение высшего образования ""Воронежский государственный медицинский университет имени Н.Н. Бурденко"" Министерства здравоохранения Российской Федерации"
