ФИО,№ стипендии,Тема,Организация
Кудряшова Анастасия Александровна,СП-354.2021.4,Влияние термомеханической обработки на структуру и функциональные свойства сверхупругого сплава Ti-Zr-Nb медицинского назначения,Федеральное государственное автономное образовательное учреждение высшего образования “Национальный исследовательский технологический университет «МИСиС»
Кузин Юрий Иванович,СП-2530.2021.4,"""Комбинирование полиэлектролитных комплексов и полимеров с молекулярными отпечатками для улучшения характеристик электрохимических сенсоров""",Федеральное государственное автономное образовательное учреждение высшего образования «Казанский (Приволжский) федеральный университет»
Кузнецов Виталий Анатольевич,СП-1553.2021.4,Полимерные композиционные материалы – перспективная основа сенсоров деформации для биомеханических приложений в медицине,Федеральное государственное бюджетное учреждение науки Институт неорганической химии им. А.В. Николаева Сибирского отделения Российской академии наук
Кузнецов Максим Борисович,СП-5042.2021.4,Оптимизация протоколов комбинированной противоопухолевой химиотерапии и антиангиогенной терапии методом математического моделирования,Федеральное государственное бюджетное учреждение науки Физический институт им. П.Н. Лебедева Российской академии наук
Кузьмина Наталья Сергеевна,СП-1760.2021.4,Синтез новых фоторасщепляемых агентов на основе порфиринового фотосенсибилизатора и аналога дуокармицина как высокоактивного химиопрепарата для комбинированной терапии онкологических заболеваний,Федеральное государственное автономное образовательное учреждение высшего образования «Национальный исследовательский Нижегородский государственный университет им. Н.И. Лобачевского»
Курсанов Александр Геннадьевич,СП-5654.2021.4,Исследование механизмов аритмогенеза и выявления мишеней для фармакологической коррекции аритмий при острой сердечной недостаточности в компьютерной модели миокарда человека,Федеральное государственное бюджетное учреждение науки Институт иммунологии и физиологии Уральского отделения Российской академии наук
Ларионова Ирина Валерьевна,СП-3477.2021.4,Определение ключевых параметров иммунного статуса опухоли по циркулирующим моноцитам с целью персонификации противоопухолевой терапии,Федеральное государственное автономное образовательное учреждение высшего образования «Национальный исследовательский Томский государственный университет»
Лебедева Альбина Владимировна,СП-4882.2021.4,Исследование принципов функционирования нейрон-глиальных сетей у новых мутантных линий мышей,Федеральное государственное автономное образовательное учреждение высшего образования «Национальный исследовательский Нижегородский государственный университет им. Н.И. Лобачевского»
Ли-Жуланов Николай Сергеевич,СП-483.2021.4,Синтез новых биологически активных азотсодержащих октагидрохроменов на основе монотерпеноида (-)-изопулегола,Федеральное государственное бюджетное учреждение науки Новосибирский институт органической химии им. Н.Н. Ворожцова Сибирского отделения Российской академии наук
Литвиненко Алёна Леонидовна,СП-1886.2021.4,Разработка метода количественного определения чувствительности популяции тромбоцитов к аденозиндифосфату (АДФ). Оценка применимости метода для диагностики патологий системы кровообращения. ,Федеральное государственное бюджетное учреждение науки Институт химической кинетики и горения им. В.В. Воеводского Сибирского отделения Российской академии наук
Литвинова Валерия Александровна,СП-964.2021.4,Получение новых азотсодержащих производных антрахинона и изучение их противоопухолевых свойств ,"Федеральное государственное бюджетное научное учреждение ""Научно-исследовательский институт по изысканию новых антибиотиков имени Г.Ф. Гаузе"""
Ломовский Алексей Игоревич,СП-731.2021.4,Противоопухолевое действие мелатонина и его применение в повышении эффективности терапии острого миелоидного лейкоза,Федеральное государственное бюджетное учреждение науки Институт теоретической и экспериментальной биофизики Российской академии наук
Лопухова Мария Владимировна,СП-5357.2021.4,Разработка систем на основе магнитных наночастиц для тераностики опухолей,Федеральное государственное бюджетное учреждение науки Институт биохимической физики им. Н.М. Эмануэля Российской академии наук
Макеева Дарья Валерьевна,СП-3097.2021.4,"Концентрирование и электрофоретическое определение белков, катехоламинов, карбоновых кислот и нуклеотидов с  применением  наноразмерных модификаторов","Федеральное государственное бюджетное образовательное учреждение высшего образования ""Санкт-Петербургский государственный университет"""
Маляренко Олеся Сергеевна,СП-1216.2021.4,Химические модификации ламинаранов бурых водорослей для создания терапевтических агентов с высоким антиметастатическим потенциалом,Федеральное государственное бюджетное учреждение науки Тихоокеанский институт биоорганической химии им. Г.Б. Елякова Дальневосточного отделения Российской академии наук
Мамонтова Евгения Михайловна,СП-4140.2021.4,регуляция репарации ДНК с участием белка FUS через образование временных компартментов в районе сайтов повреждений ДНК,Федеральное государственное автономное образовательное учреждение высшего образования «Новосибирский национальный исследовательский государственный университет»
Маркварт Александр Александрович,СП-5971.2021.4,Высокочувствительные волоконно-оптические датчики давления для медицинских диагностических систем,Федеральное государственное автономное образовательное учреждение высшего образования «Санкт-Петербургский политехнический университет Петра Великого»
Маркина Наталья Евгеньевна,СП-1115.2021.4,Разработка электрохимической ячейки на основе медных электродов для ГКР детектирования компонентов биожидкостей человека,"Федеральное государственное бюджетное образовательное учреждение высшего образования ""Саратовский национальный исследовательский государственный университет имени Н.Г. Чернышевского"""
Марков Андрей Владимирович,СП-4718.2021.4,"Адипокины и опухолевая прогрессия: взаимосвязь, мастер-регуляторы и терапевтические подходы",Федеральное государственное бюджетное учреждение науки Институт химической биологии и фундаментальной медицины Сибирского отделения Российской академии наук
Марьясина Софья Семеновна,СП-5018.2021.4,Структурные исследования метилтрансфераз методами спектроскопии ЯМР,Федеральное государственное бюджетное образовательное учреждение высшего образования «Московский государственный университет имени М.В.Ломоносова»
Меднова Ирина Андреевна,СП-1182.2021.4,Поиск периферических биологических маркеров суицидального поведения у больных шизофренией,"Федеральное государственное бюджетное научное учреждение ""Томский национальный исследовательский медицинский центр Российской академии наук"""
Мендограло Елена Юрьевна <i>(Зелина)</i>,СП-1529.2021.4,"Разработка эффективных методов синтеза природных физиологически активных соединений, обладающих антибактериальной активностью, с целью поиска новых механизмов биологического действия и создания инновационных лекарственных препаратов",Федеральное государственное автономное образовательное учреждение высшего образования «Пермский государственный национальный исследовательский университет»
Меркушев Дмитрий Александрович,СП-5338.2021.4,"Получение, спектральные свойства и возможности применения в медицинской диагностике новых инфракрасных молекулярных сенсоров на основе BODIPY","Федеральное государственное бюджетное образовательное учреждение высшего образования ""Ивановский государственный химико-технологический университет"""
Мирзаев Карин Бадавиевич,СП-2839.2021.4,Изучение роли молекулярных биомаркеров для персонализации применения антитромбоцитарных препаратов у пациентов с сердечно-сосудистыми заболеваниями,Федеральное государственное бюджетное образовательное учреждение дополнительного профессионального образования «Российская медицинская академия непрерывного профессионального образования» Министерства здравоохранения Российской Федерации
Моргунова Галина Васильевна,СП-3503.2021.4,"Моделирование процессов старения in vitro с использованием стационарных клеточных культур: исследование ""возрастных"" изменений метаболизма глюкозы и поиск потенциальных геропротекторов среди миметиков ограничения питания",Федеральное государственное бюджетное образовательное учреждение высшего образования «Московский государственный университет имени М.В.Ломоносова»
Мурко Андрей Юрьевич,СП-2621.2021.4,Полифункциональные водорастворимые синтетические полимерные системы как основа для создания макромолекулярных радиофармацевтических препаратов,Федеральное государственное бюджетное учреждение науки Институт высокомолекулярных соединений Российской академии наук
Мусин Егор Валиевич,СП-1749.2021.4,"Инкапсулирование бактериофага в полиэлектролитные микрокапсулы обеспечивающие защиту, адресную доставку, пролонгированное высвобождение и высокую эффективность, для решения проблем фаготерапии. ",Федеральное государственное бюджетное учреждение науки Институт теоретической и экспериментальной биофизики Российской академии наук
Надараиа Константинэ Вахтангович,СП-4324.2021.4,Антибактериальные остеогенерирующие покрытия на магниевых сплавах для нужд имплантационной хирургии,Федеральное государственное бюджетное учреждение науки Институт химии Дальневосточного отделения Российской академии наук
Назаров Денис Васильевич,СП-1934.2021.4,Модифицирование поверхности сплава нитинола методами химического травления и молекулярного наслаивания для улучшения биомедицинских свойств,Федеральное государственное автономное образовательное учреждение высшего образования «Санкт-Петербургский политехнический университет Петра Великого»
Назарова Анна Александровна,СП-4063.2021.4,"Разработка вживляемого оптического биосенсора, чувствительного к антибиотикам тетрациклиновой группы",Федеральное государственное бюджетное образовательное учреждение высшего образования «Иркутский государственный университет»
Некрасов Павел Валерьевич,СП-6056.2021.4,Исследование механизмов старения в постмитотических клетках - нейронах и миоцитах с целью коррекции сенесценции на основе белка YB-1,Федеральное государственное бюджетное учреждение науки Институт теоретической и экспериментальной биофизики Российской академии наук
Никитина Вита Николаевна,СП-5285.2021.4,Проточно-инжекционная амперометрия для анализа физиологических жидкостей на электролиты и лактат  с твердоконтактными сенсорами на основе электроактивных полимеров,Федеральное государственное бюджетное образовательное учреждение высшего образования «Московский государственный университет имени М.В.Ломоносова»
Никитина Елена Юрьевна,СП-4571.2021.4,"Разработка средств топического применения с антимикробной, противоопухолевой и репаративной активностью на основе глицеролатов кремния с использованием наночастиц Ag, Fe3O4 и активных лекарственных веществ",Федеральное государственное бюджетное учреждение науки Институт органического синтеза им. И.Я. Постовского Уральского отделения Российской академии наук
Николаева Надежда Анатольевна,СП-3531.2021.4,"Разработка и внедрение новых комплексных подходов исследования актуальных задач медицины с применением методов спектроскопии, микроскопии, радиационной биофизики и математического моделирования","Федеральное государственное автономное образовательное учреждение высшего образования ""Северо-Восточный федеральный университет имени М.К. Аммосова"""
Новикова Дарья Сергеевна,СП-2008.2021.4,Химерные молекулы для повышения таргетности противоопухолевой терапии за счет субстрат-специфичной активации АМФК,"Федеральное государственное бюджетное образовательное учреждение высшего образования ""Санкт-Петербургский государственный технологический институт (технический университет)"""
Осипов Дмитрий Владимирович,СП-779.2021.4,Получение новых производных бензофуранов и хроменов в качестве ингибиторов альфа-глюкозидазы с гипогликемической активностью,"Федеральное государственное бюджетное образовательное учреждение высшего образования ""Самарский государственный технический университет"""
Осмоловский Александр Андреевич,СП-3906.2021.4,Разработка кандидатного диагностического набора для лабораторного определения протеина С и фактора Х на основе грибных протеолитических ферментов,Федеральное государственное бюджетное образовательное учреждение высшего образования «Московский государственный университет имени М.В.Ломоносова»
Отвагин Василий Федорович,СП-1827.2021.4,"Новые расщепляемые конъюгированные фотосенсибилизаторы на основе порфириновых соединений и агентов химиотерапии: дизайн, синтез и противоопухолевая активность",Федеральное государственное автономное образовательное учреждение высшего образования «Национальный исследовательский Нижегородский государственный университет им. Н.И. Лобачевского»
Очиров Олег Сергеевич,СП-2036.2021.4,"Разработка многокомпонентных средств и изделий медицинского назначения на основе производных полигуанидинов, обладающих антимикробным, гемостатическим и стимулирующим регенеративные процессы действием",Федеральное государственное бюджетное учреждение науки Байкальский институт природопользования Сибирского отделения Российской академии наук
Пескова Нина Николаевна,СП-2067.2021.4,Пероксид водорода как потенциальный посредник «эффекта свидетеля» при фотодинамическом воздействии,Федеральное государственное автономное образовательное учреждение высшего образования «Национальный исследовательский Нижегородский государственный университет им. Н.И. Лобачевского»
Петунин Павел Васильевич,СП-1621.2021.4,Управляемые терапевтические агенты на основе производных вердазильных радикалов,Федеральное государственное автономное образовательное учреждение высшего образования «Национальный исследовательский Томский политехнический университет»
Полковникова Юлия Александровна,СП-22.2021.4,"Разработка липосомальных лекарственных форм, предназначенных для коррекции осложнений коронавирусной инфекции",Федеральное государственное бюджетное образовательное учреждение высшего образования «Воронежский государственный университет»
