ФИО,№ стипендии,Тема,Организация
,,,
Абдуракипов Сергей Сергеевич,СП-3373.2016.1,Развитие методов интеллектуального управления процессами в энергетике ,Федеральное государственное бюджетное учреждение науки Институт теплофизики им. С.С. Кутателадзе Сибирского отделения Российской академии наук
Агарков Дмитрий Александрович,СП-3765.2016.1,Исследование кинетики окислительно-восстановительных реакций на анодном электроде ТОТЭ в рабочих условиях методами спектроскопии комбинационного рассеяния света и хронопотенциометрии,Федеральное государственное бюджетное учреждение науки Институт физики твердого тела имени Ю.А. Осипьяна Российской академии наук
Адонин Сергей Александрович,СП-3647.2016.1,Полиядерные галогенидные комплексы висмута: перспективные материалы для фотосенсоров и хемосенсорных люминесцентных материалов,Федеральное государственное бюджетное учреждение науки Институт неорганической химии им. А.В. Николаева Сибирского отделения Российской академии наук
Аккуратов Александр Витальевич,СП-835.2016.1,Направленный синтез сопряженных полимеров с малой шириной запрещенной зоны как перспективных полупроводниковых материалов для органических солнечных батарей,Федеральное государственное бюджетное учреждение науки Институт проблем химической физики Российской академии наук
Аксёнова Крестина Владимировна,СП-1335.2016.1,Разработка технологических режимов формирования комплекса повышенных эксплуатационных свойств бейнитной конструкционной стали для использования в энергетической отрасли промышленности,"Федеральное государственное бюджетное образовательное учреждение высшего образования ""Сибирский государственный индустриальный университет"""
Ананьев Сергей Станиславович,СП-1014.2016.1,Расчет содержания трития в элементах систем топливного цикла термоядерного источника нейтронов ,"Федеральное государственное бюджетное учреждение ""Национальный исследовательский центр ""Курчатовский институт"""
Аракчеев Алексей Сергеевич,СП-4010.2016.1,"Теоретическое моделирование развития трещин, появившихся на поверхности материалов после импульсной тепловой нагрузки",Федеральное государственное бюджетное учреждение науки Институт ядерной физики им. Г.И. Будкера Сибирского отделения Российской академии наук
Артемьев Александр Алексеевич,СП-3933.2016.1,Разработка энерго- и ресурсосберегающих материалов и технологий получения стойких к высокотемпературному абразивному изнашиванию наплавленных покрытий,Федеральное государственное бюджетное образовательное учреждение высшего образования «Волгоградский государственный технический университет»
Артёмов Антон Петрович,СП-3959.2016.1,Исследование источников мягкого рентгеновского излучения на основе Х-пинчей с целью создания перспективных радиографических комплексов,Федеральное государственное бюджетное учреждение науки Институт сильноточной электроники Сибирского отделения Российской академии наук
Ахметшина Алсу Исламовна,СП-831.2016.1,Газоразделительные мембраны для очистки аммиака на основе полимеров с высоким свободным объемом и ионных жидкостей ,"Федеральное государственное бюджетное образовательное учреждение высшего образования ""Нижегородский государственный технический университет им. Р.Е. Алексеева"""
Бабайцев Арсений Владимирович,СП-1286.2016.1,Разработка методов оценки прочности теплозащитных керамических покрытий в условиях циклического нагрева с учетом особенностей состава и микроструктуры.,"Федеральное государственное бюджетное образовательное учреждение высшего образования ""Московский авиационный институт (национальный исследовательский университет)"""
Баженов Вячеслав Евгеньевич,СП-1579.2016.1,Повышение адекватности компьютерного моделирования литейных процессов с целью экономии ресурсов машиностроительных и авиастроительных предприятий,Федеральное государственное автономное образовательное учреждение высшего образования “Национальный исследовательский технологический университет «МИСиС»
Байбакова Ольга Владимировна,СП-152.2016.1,Разработка энергоэффективной ресурсосберегающей технологии биоэтанола из энергетических растений и сельскохозяйственных отходов для технических целей,Федеральное государственное бюджетное учреждение науки Институт проблем химико-энергетических технологий Сибирского отделения Российской академии наук
Баймуратов Анвар Саматович,СП-2066.2016.1,Методы создания искусственной оптической активности неорганических нанокристаллов и структур на их основе,Федеральное государственное автономное образовательное учреждение высшего образования «Национальный исследовательский университет ИТМО»
Беленов Сергей Валерьевич,СП-239.2016.1,"Новые подходы к синтезу, постобработке и характеризации высокоэффективных платиносодержащих катализаторов для низкотемпературных топливных элементов",Федеральное государственное автономное образовательное учреждение высшего образования «Южный федеральный университет»
Белинская Наталия Сергеевна,СП-2724.2016.1,Разработка подходов к повышению ресурсо- и энергоэффективности в процессе каталитической депарафинизации средних дистиллятов нефти,Федеральное государственное автономное образовательное учреждение высшего образования «Национальный исследовательский Томский политехнический университет»
Белов Александр Александрович,СП-1294.2016.1,Моделирование химической кинетики в газах,Федеральное государственное бюджетное образовательное учреждение высшего образования «Московский государственный университет имени М.В.Ломоносова»
Белов Дмитрий Сергеевич,СП-4314.2016.1,Наноструктурные керамикометаллические упрочняющие покрытия на режущем инструменте расширенной области применения для энергосбережения при резании труднообрабатываемых материалов,Федеральное государственное автономное образовательное учреждение высшего образования “Национальный исследовательский технологический университет «МИСиС»
Белова Алина Игоревна,СП-3974.2016.1,Легированный графен для электрохимических накопителей и преобразователей энергии: влияние электронной структуры на электрокаталитическую активность в редокс реакциях кислорода,Федеральное государственное бюджетное образовательное учреждение высшего образования «Московский государственный университет имени М.В.Ломоносова»
Бельский Алексей Анатольевич,СП-349.2016.1,Разработка энергоэффективной технологии применения возобновляемых источников энергии в качестве первичного энергоносителя для теплового воздействия на трудноизвлекаемые залежи высоковязкой нефти,"Федеральное государственное бюджетное образовательное учреждение высшего образования ""Санкт-Петербургский горный университет"""
Бельтюков Ярослав Михайлович,СП-3299.2016.1,Исследование тепловых свойств аморфных материалов,Федеральное государственное бюджетное учреждение науки Физико-технический институт им. А.Ф. Иоффе Российской академии наук
Биглова Юлия Николаевна,СП-4089.2016.1,Синтез и исследование новых эффективных фотоактивных материалов для преобразования солнечной энергии,Федеральное государственное бюджетное образовательное учреждение высшего образования «Башкирский государственный университет»
Богданов Артём Игоревич,СП-1452.2016.1,Разработка технологии получения жаро- и термостойких покрытий на основе легированных алюминидов никеля для деталей и узлов авиа- и ракетостроения с целью повышения их энергоэффективности и надежности,Федеральное государственное бюджетное образовательное учреждение высшего образования «Волгоградский государственный технический университет»
Брюзгин Евгений Викторович,СП-1757.2016.1,Закономерности формирования и исследование свойств привитых метакриловых полимерных покрытий на поверхности металлов и полимерных материалов,Федеральное государственное бюджетное образовательное учреждение высшего образования «Волгоградский государственный технический университет»
Валиев Дамир Талгатович,СП-535.2016.1,Спектроскопические исследования и процессы передачи энергии в сцинтилляционных материалах. ,Федеральное государственное автономное образовательное учреждение высшего образования «Национальный исследовательский Томский политехнический университет»
Васильев Алексей Владимирович,СП-2128.2016.1,Пилотный этап радонового обследования России: проблема энергосберегающих технологий строительства в контексте защиты от радона,Федеральное государственное бюджетное учреждение науки Институт промышленной экологии Уральского отделения Российской академии наук
Васильев Евгений Викторович,СП-2241.2016.1,Повышение энергоэффективности авиационного и космического транспорта,Федеральное государственное бюджетное образовательное учреждение высшего образования «Тольяттинский государственный университет»
Васильченко Данила Борисович,СП-658.2016.1,Молекулярный дизайн активных центров катализаторов на основе полиядерных комплексов платиновых металлов,Федеральное государственное бюджетное учреждение науки Институт неорганической химии им. А.В. Николаева Сибирского отделения Российской академии наук
Вдовин Максим Игоревич,СП-1740.2016.1,"Исследование динамики аэро- и гидрофизических процессов в пограничных слоях атмосферы и гидросферы, в рамках натурных экспериментов, лабораторного и численного моделирования для нужд развития альтернативной энергетики в прибрежной зоне.",Федеральное государственное автономное образовательное учреждение высшего образования «Национальный исследовательский Нижегородский государственный университет им. Н.И. Лобачевского»
Велигжанин Алексей Александрович,СП-982.2016.1,Анализ особенностей многомасштабной структуры функциональных материалов с использованием взаимодополняющих синхротронных структурных методов,"Федеральное государственное бюджетное учреждение ""Национальный исследовательский центр ""Курчатовский институт"""
Веселовская Жанна Вячеславовна,СП-3321.2016.1,Разработка сорбционно-каталитического метода получения метана из атмосферного углекислого газа	,Федеральное государственное бюджетное учреждение науки «Федеральный исследовательский центр «Институт катализа им. Г.К. Борескова Сибирского отделения Российской академии наук»
Виноградова Катерина Александровна,СП-3141.2016.1,Синтез и исследование люминесцирующих комплексов Cu(I) c производными диазинов и фосфинов. Термохромизм и механохромизм люминесценции многоядерных соединений Cu(I). Люминесценция наночастиц комплексов Cu(I),Федеральное государственное бюджетное учреждение науки Институт неорганической химии им. А.В. Николаева Сибирского отделения Российской академии наук
Волков Александр Владимирович,СП-1327.2016.1,Решение задачи о нестационарном прогреве неоднородного слоя и полого многослойного цилиндра в градиентной модели пористых сред.,Федеральное государственное бюджетное учреждение науки Институт прикладной механики Российской академии наук
Волков Александр Геннадьевич,СП-158.2016.1,"Разработка энергоэффективных автономных систем генерирования электрической энергии для ветроэнергетических установок наземного назначения, на базе многозонных конверторов с использованием микропроцессорных систем управления на базе ПЛИС",Федеральное государственное бюджетное образовательное учреждение высшего образования «Новосибирский государственный технический университет»
Воловликова Ольга Вениаминовна <i>(Пятилова)</i>,СП-1969.2016.1,Разработка основ технологии формирования кремниевых 3D структур в качестве функционального материала для бета-вольтаических источников питания,Федеральное государственное автономное образовательное учреждение высшего образования «Национальный исследовательский университет «Московский институт электронной техники»
Волхонский Алексей Олегович,СП-311.2016.1,"Разработка износостойких, самоадаптирующихся к меняющимся условиям трения покрытий, снижающих потери энергии при применении на парах-трения",Федеральное государственное автономное образовательное учреждение высшего образования “Национальный исследовательский технологический университет «МИСиС»
Воротынцев Андрей Владимирович,СП-253.2016.1,Физико-химические основы создания новых высокоселективных каталитических систем для процессов получения высокочистого кремния и германия для микро- и наноэлектронной промышленности,"Федеральное государственное бюджетное образовательное учреждение высшего образования ""Нижегородский государственный технический университет им. Р.Е. Алексеева"""
Гаврилин Илья Михайлович,СП-92.2016.1,Разработка принципов управления электрофизическими и электрохимическими свойствами пористого анодного оксида титана для создания приборов генерации и хранения энергии.,Федеральное государственное автономное образовательное учреждение высшего образования «Национальный исследовательский университет «Московский институт электронной техники»
Гладких Виталий Александрович,СП-2627.2016.1,Разработка энергоэффективной технологии сероасфальтобетона для дорожного строительства,Федеральное государственное бюджетное образовательное учреждение высшего образования «Национальный исследовательский Московский государственный строительный университет»
Гладских Игорь Аркадьевич,СП-1743.2016.1,Оптические и электрические свойства самоорганизованных плазмонных наноструктур вблизи порога перколяции,Федеральное государственное автономное образовательное учреждение высшего образования «Национальный исследовательский университет ИТМО»
Головастов Сергей Викторович,СП-1501.2016.1,Экспериментальное и численное исследование самовоспламенения недорасширенной импульсной струи водорода,Федеральное государственное бюджетное учреждение науки Объединенный институт высоких температур Российской академии наук
Гольцман Борис Михайлович,СП-1074.2016.1,Разработка технологии многослойных теплоизоляционных строительных панелей на основе отходов промышленности,Федеральное государственное бюджетное образовательное учреждение высшего образования «Южно-Российский государственный политехнический университет (НПИ) имени М.И. Платова»
Гончар Кирилл Александрович,СП-146.2016.1,Использование кремниевых нанонитей для создания термоэлектрических преобразователей,Федеральное государственное бюджетное образовательное учреждение высшего образования «Московский государственный университет имени М.В.Ломоносова»
